Protein id	Contig id	Start	Stop	Strand	Element symbol	Element name	Scope	Type	Subtype	Class	Subclass	Method	Target length	Reference sequence length	% Coverage of reference	% Identity to reference	Alignment length	Closest reference accession	Closest reference name	HMM accession	HMM description
NA	DBKRZT010000005.1	111216	113840	-	gyrA_S83L	Escherichia quinolone resistant GyrA	core	AMR	POINT	QUINOLONE	QUINOLONE	POINTX	875	878	99.66	98.97	875	WP_001281243.1	DNA gyrase subunit A GyrA	NA	NA
NA	DBKRZT010000009.1	7643	9532	-	parE_I355T	Escherichia quinolone resistant ParE	core	AMR	POINT	QUINOLONE	QUINOLONE	POINTX	630	630	100.00	99.68	630	WP_033554192.1	DNA topoisomerase IV subunit B ParE	NA	NA
NA	DBKRZT010000030.1	10082	12625	-	cyaA_S352T	Escherichia fosmidomycin resistant CyaA	core	AMR	POINT	FOSMIDOMYCIN	FOSMIDOMYCIN	POINTX	848	848	100.00	99.17	848	WP_000281668.1	adenylate cyclase CyaA	NA	NA
NA	DBKRZT010000044.1	15084	15941	-	blaTEM-1	broad-spectrum class A beta-lactamase TEM-1	core	AMR	AMR	BETA-LACTAM	BETA-LACTAM	ALLELEX	286	286	100.00	100.00	286	WP_000027057.1	broad-spectrum class A beta-lactamase TEM-1	NA	NA
NA	DBKRZT010000114.1	2831	4219	-	uhpT_E350Q	Escherichia fosfomycin resistant UhpT	core	AMR	POINT	FOSFOMYCIN	FOSFOMYCIN	POINTX	463	463	100.00	99.78	463	WP_000879194.1	hexose phosphate transporter UhpT	NA	NA
NA	DBKRZT010000208.1	3945	4802	+	blaTEM-1	broad-spectrum class A beta-lactamase TEM-1	core	AMR	AMR	BETA-LACTAM	BETA-LACTAM	ALLELEX	286	286	100.00	100.00	286	WP_000027057.1	broad-spectrum class A beta-lactamase TEM-1	NA	NA
