Protein id	Contig id	Start	Stop	Strand	Element symbol	Element name	Scope	Type	Subtype	Class	Subclass	Method	Target length	Reference sequence length	% Coverage of reference	% Identity to reference	Alignment length	Closest reference accession	Closest reference name	HMM accession	HMM description
NA	JAMFDZ010000011.1	68778	71402	-	gyrA_D87N	Escherichia quinolone resistant GyrA	core	AMR	POINT	QUINOLONE	QUINOLONE	POINTX	875	878	99.66	98.97	875	WP_001281243.1	DNA gyrase subunit A GyrA	NA	NA
NA	JAMFDZ010000011.1	68778	71402	-	gyrA_S83L	Escherichia quinolone resistant GyrA	core	AMR	POINT	QUINOLONE	QUINOLONE	POINTX	875	878	99.66	98.97	875	WP_001281243.1	DNA gyrase subunit A GyrA	NA	NA
NA	JAMFDZ010000037.1	24023	26278	-	parC_S80I	Escherichia quinolone resistant ParC	core	AMR	POINT	QUINOLONE	QUINOLONE	POINTX	752	752	100.00	99.87	752	WP_001281881.1	DNA topoisomerase IV subunit A ParC	NA	NA
NA	JAMFDZ010000037.1	30995	32884	-	parE_S458A	Escherichia quinolone resistant ParE	core	AMR	POINT	QUINOLONE	QUINOLONE	POINTX	630	630	100.00	99.68	630	WP_033554192.1	DNA topoisomerase IV subunit B ParE	NA	NA
NA	JAMFDZ010000062.1	18	488	+	dfrA14	trimethoprim-resistant dihydrofolate reductase DfrA14	core	AMR	AMR	TRIMETHOPRIM	TRIMETHOPRIM	EXACTX	157	157	100.00	100.00	157	WP_004201280.1	trimethoprim-resistant dihydrofolate reductase DfrA14	NA	NA
NA	JAMFDZ010000062.1	2965	4200	-	mrx(A)	phosphorylated macrolide efflux MFS transporter Mrx(A)	core	AMR	AMR	MACROLIDE	AZITHROMYCIN/ERYTHROMYCIN/SPIRAMYCIN/TELITHROMYCIN	EXACTX	412	412	100.00	100.00	412	WP_000004159.1	phosphorylated macrolide efflux MFS transporter Mrx(A)	NA	NA
NA	JAMFDZ010000062.1	4200	5102	-	mph(A)	Mph(A) family macrolide 2'-phosphotransferase	core	AMR	AMR	MACROLIDE	AZITHROMYCIN/ERYTHROMYCIN/SPIRAMYCIN/TELITHROMYCIN	EXACTX	301	301	100.00	100.00	301	WP_000219391.1	Mph(A) family macrolide 2'-phosphotransferase	NA	NA
NA	JAMFDZ010000063.1	529	1317	-	aadA2	ANT(3'')-Ia family aminoglycoside nucleotidyltransferase AadA2	core	AMR	AMR	AMINOGLYCOSIDE	STREPTOMYCIN	EXACTX	263	263	100.00	100.00	263	WP_001261740.1	ANT(3'')-Ia family aminoglycoside nucleotidyltransferase AadA2	NA	NA
NA	JAMFDZ010000063.1	2082	2921	-	estX-3	macrolide esterase EstX-3	core	AMR	AMR	MACROLIDE	TYLOSIN	ALLELEX	280	280	100.00	100.00	280	WP_001456218.1	macrolide esterase EstX-3	NA	NA
NA	JAMFDZ010000064.1	151	1008	-	blaTEM-1	broad-spectrum class A beta-lactamase TEM-1	core	AMR	AMR	BETA-LACTAM	BETA-LACTAM	ALLELEX	286	286	100.00	100.00	286	WP_000027057.1	broad-spectrum class A beta-lactamase TEM-1	NA	NA
NA	JAMFDZ010000065.1	2	847	+	cmlA1	chloramphenicol efflux MFS transporter CmlA1	core	AMR	AMR	PHENICOL	CHLORAMPHENICOL	PARTIAL_CONTIG_ENDX	282	419	67.30	99.65	282	WP_000095725.1	chloramphenicol efflux MFS transporter CmlA1	NA	NA
NA	JAMFDZ010000065.1	943	1731	+	aadA1	ANT(3'')-Ia family aminoglycoside nucleotidyltransferase AadA1	core	AMR	AMR	AMINOGLYCOSIDE	STREPTOMYCIN	EXACTX	263	263	100.00	100.00	263	WP_001206316.1	ANT(3'')-Ia family aminoglycoside nucleotidyltransferase AadA1	NA	NA
NA	JAMFDZ010000065.1	1904	2233	+	qacL	quaternary ammonium compound efflux SMR transporter QacL	core	STRESS	BIOCIDE	QUATERNARY AMMONIUM	QUATERNARY AMMONIUM	EXACTX	110	110	100.00	100.00	110	WP_000800531.1	quaternary ammonium compound efflux SMR transporter QacL	NA	NA
NA	JAMFDZ010000065.1	3419	4207	-	sul3	sulfonamide-resistant dihydropteroate synthase Sul3	core	AMR	AMR	SULFONAMIDE	SULFONAMIDE	EXACTX	263	263	100.00	100.00	263	WP_000034420.1	sulfonamide-resistant dihydropteroate synthase Sul3	NA	NA
NA	JAMFDZ010000089.1	9296	10492	-	tet(A)	tetracycline efflux MFS transporter Tet(A)	core	AMR	AMR	TETRACYCLINE	TETRACYCLINE	EXACTX	399	399	100.00	100.00	399	WP_000804064.1	tetracycline efflux MFS transporter Tet(A)	NA	NA
NA	JAMFDZ010000090.1	2875	4086	-	floR	chloramphenicol/florfenicol efflux MFS transporter FloR	core	AMR	AMR	PHENICOL	CHLORAMPHENICOL/FLORFENICOL	BLASTX	404	404	100.00	99.50	404	WP_000214119.1	chloramphenicol/florfenicol efflux MFS transporter FloR	NA	NA
NA	JAMFDZ010000090.1	6268	7101	-	aph(6)-Id	aminoglycoside O-phosphotransferase APH(6)-Id	core	AMR	AMR	AMINOGLYCOSIDE	STREPTOMYCIN	EXACTX	278	278	100.00	100.00	278	WP_000480968.1	aminoglycoside O-phosphotransferase APH(6)-Id	NA	NA
NA	JAMFDZ010000090.1	7104	7904	-	aph(3'')-Ib	aminoglycoside O-phosphotransferase APH(3'')-Ib	core	AMR	AMR	AMINOGLYCOSIDE	STREPTOMYCIN	EXACTX	267	267	100.00	100.00	267	WP_001082319.1	aminoglycoside O-phosphotransferase APH(3'')-Ib	NA	NA
NA	JAMFDZ010000090.1	10133	10945	-	aph(3')-Ia	aminoglycoside O-phosphotransferase APH(3')-Ia	core	AMR	AMR	AMINOGLYCOSIDE	KANAMYCIN	EXACTX	271	271	100.00	100.00	271	WP_000018329.1	aminoglycoside O-phosphotransferase APH(3')-Ia	NA	NA
