Protein id	Contig id	Start	Stop	Strand	Element symbol	Element name	Scope	Type	Subtype	Class	Subclass	Method	Target length	Reference sequence length	% Coverage of reference	% Identity to reference	Alignment length	Closest reference accession	Closest reference name	HMM accession	HMM description
NA	ABNHWN020000001.1	57085	57804	-	nfsA_H11Y	Escherichia nitrofurantoin resistant NfsA	core	AMR	POINT	NITROFURAN	NITROFURANTOIN	POINTX	240	240	100.00	97.92	240	WP_089631889.1	nitroreductase NfsA	NA	NA
NA	ABNHWN020000002.1	117249	119873	-	gyrA_D87N	Escherichia quinolone resistant GyrA	core	AMR	POINT	QUINOLONE	QUINOLONE	POINTX	875	878	99.66	98.86	875	WP_001281243.1	DNA gyrase subunit A GyrA	NA	NA
NA	ABNHWN020000002.1	117249	119873	-	gyrA_S83L	Escherichia quinolone resistant GyrA	core	AMR	POINT	QUINOLONE	QUINOLONE	POINTX	875	878	99.66	98.86	875	WP_001281243.1	DNA gyrase subunit A GyrA	NA	NA
NA	ABNHWN020000002.1	307145	308869	+	ptsI_V25I	Escherichia fosfomycin resistant PtsI	core	AMR	POINT	FOSFOMYCIN	FOSFOMYCIN	POINTX	575	575	100.00	99.65	575	WP_000623140.1	phosphoenolpyruvate--protein phosphotransferase PtsI	NA	NA
NA	ABNHWN020000003.1	347063	348451	-	uhpT_E350Q	Escherichia fosfomycin resistant UhpT	core	AMR	POINT	FOSFOMYCIN	FOSFOMYCIN	POINTX	463	463	100.00	99.78	463	WP_000879194.1	hexose phosphate transporter UhpT	NA	NA
NA	ABNHWN020000007.1	3	809	-	blaCTX-M	CTX-M family extended-spectrum class A beta-lactamase	core	AMR	AMR	BETA-LACTAM	CEPHALOSPORIN	BLASTX	269	291	92.44	100.00	269	WP_000239590.1	extended-spectrum class A beta-lactamase CTX-M-15	NA	NA
NA	ABNHWN020000009.1	86868	89123	-	parC_E84V	Escherichia quinolone resistant ParC	core	AMR	POINT	QUINOLONE	QUINOLONE	POINTX	752	752	100.00	99.20	752	WP_001281881.1	DNA topoisomerase IV subunit A ParC	NA	NA
NA	ABNHWN020000009.1	86868	89123	-	parC_S80I	Escherichia quinolone resistant ParC	core	AMR	POINT	QUINOLONE	QUINOLONE	POINTX	752	752	100.00	99.20	752	WP_001281881.1	DNA topoisomerase IV subunit A ParC	NA	NA
NA	ABNHWN020000009.1	104119	106008	-	parE_I529L	Escherichia quinolone resistant ParE	core	AMR	POINT	QUINOLONE	QUINOLONE	POINTX	630	630	100.00	99.52	630	WP_033554192.1	DNA topoisomerase IV subunit B ParE	NA	NA
NA	ABNHWN020000045.1	901	1371	+	dfrA17	trimethoprim-resistant dihydrofolate reductase DfrA17	core	AMR	AMR	TRIMETHOPRIM	TRIMETHOPRIM	EXACTX	157	157	100.00	100.00	157	WP_001389366.1	trimethoprim-resistant dihydrofolate reductase DfrA17	NA	NA
NA	ABNHWN020000045.1	1505	2290	+	aadA5	ANT(3'')-Ia family aminoglycoside nucleotidyltransferase AadA5	core	AMR	AMR	AMINOGLYCOSIDE	STREPTOMYCIN	EXACTX	262	262	100.00	100.00	262	WP_000503573.1	ANT(3'')-Ia family aminoglycoside nucleotidyltransferase AadA5	NA	NA
NA	ABNHWN020000045.1	2499	2843	+	qacEdelta1	quaternary ammonium compound efflux SMR transporter QacE delta 1	core	STRESS	BIOCIDE	QUATERNARY AMMONIUM	QUATERNARY AMMONIUM	ALLELEX	115	115	100.00	100.00	115	WP_000679427.1	quaternary ammonium compound efflux SMR transporter QacE delta 1	NA	NA
NA	ABNHWN020000045.1	2840	3676	+	sul1	sulfonamide-resistant dihydropteroate synthase Sul1	core	AMR	AMR	SULFONAMIDE	SULFONAMIDE	EXACTX	279	279	100.00	100.00	279	WP_000259031.1	sulfonamide-resistant dihydropteroate synthase Sul1	NA	NA
NA	ABNHWN020000045.1	7758	8993	-	mrx(A)	phosphorylated macrolide efflux MFS transporter Mrx(A)	core	AMR	AMR	MACROLIDE	AZITHROMYCIN/ERYTHROMYCIN/SPIRAMYCIN/TELITHROMYCIN	EXACTX	412	412	100.00	100.00	412	WP_000004159.1	phosphorylated macrolide efflux MFS transporter Mrx(A)	NA	NA
NA	ABNHWN020000045.1	9002	9904	-	mph(A)	Mph(A) family macrolide 2'-phosphotransferase	core	AMR	AMR	MACROLIDE	AZITHROMYCIN/ERYTHROMYCIN/SPIRAMYCIN/TELITHROMYCIN	BLASTX	301	301	100.00	100.00	301	WP_000219391.1	Mph(A) family macrolide 2'-phosphotransferase	NA	NA
NA	ABNHWN020000058.1	292	1026	+	erm(B)	23S rRNA (adenine(2058)-N(6))-methyltransferase Erm(B)	core	AMR	AMR	LINCOSAMIDE/MACROLIDE/STREPTOGRAMIN	CLINDAMYCIN/ERYTHROMYCIN/STREPTOGRAMIN B	BLASTX	245	245	100.00	99.59	245	WP_002321849.1	23S rRNA (adenine(2058)-N(6))-methyltransferase Erm(B)	NA	NA
NA	ABNHWN020000063.1	1697	2554	-	aac(3)-IIe	aminoglycoside N-acetyltransferase AAC(3)-IIe	core	AMR	AMR	AMINOGLYCOSIDE	GENTAMICIN	EXACTX	286	286	100.00	100.00	286	WP_000557452.1	aminoglycoside N-acetyltransferase AAC(3)-IIe	NA	NA
NA	ABNHWN020000096.1	107	1009	+	mph(A)	Mph(A) family macrolide 2'-phosphotransferase	core	AMR	AMR	MACROLIDE	AZITHROMYCIN/ERYTHROMYCIN/SPIRAMYCIN/TELITHROMYCIN	BLASTX	301	301	100.00	100.00	301	WP_000219391.1	Mph(A) family macrolide 2'-phosphotransferase	NA	NA
NA	ABNHWN020000096.1	1018	2253	+	mrx(A)	phosphorylated macrolide efflux MFS transporter Mrx(A)	core	AMR	AMR	MACROLIDE	AZITHROMYCIN/ERYTHROMYCIN/SPIRAMYCIN/TELITHROMYCIN	EXACTX	412	412	100.00	100.00	412	WP_000004159.1	phosphorylated macrolide efflux MFS transporter Mrx(A)	NA	NA
NA	ABNHWN020000096.1	6335	7171	-	sul1	sulfonamide-resistant dihydropteroate synthase Sul1	core	AMR	AMR	SULFONAMIDE	SULFONAMIDE	EXACTX	279	279	100.00	100.00	279	WP_000259031.1	sulfonamide-resistant dihydropteroate synthase Sul1	NA	NA
NA	ABNHWN020000096.1	7168	7512	-	qacEdelta1	quaternary ammonium compound efflux SMR transporter QacE delta 1	core	STRESS	BIOCIDE	QUATERNARY AMMONIUM	QUATERNARY AMMONIUM	ALLELEX	115	115	100.00	100.00	115	WP_000679427.1	quaternary ammonium compound efflux SMR transporter QacE delta 1	NA	NA
NA	ABNHWN020000096.1	7721	8506	-	aadA5	ANT(3'')-Ia family aminoglycoside nucleotidyltransferase AadA5	core	AMR	AMR	AMINOGLYCOSIDE	STREPTOMYCIN	EXACTX	262	262	100.00	100.00	262	WP_000503573.1	ANT(3'')-Ia family aminoglycoside nucleotidyltransferase AadA5	NA	NA
NA	ABNHWN020000096.1	8640	9110	-	dfrA17	trimethoprim-resistant dihydrofolate reductase DfrA17	core	AMR	AMR	TRIMETHOPRIM	TRIMETHOPRIM	EXACTX	157	157	100.00	100.00	157	WP_001389366.1	trimethoprim-resistant dihydrofolate reductase DfrA17	NA	NA
NA	ABNHWN020000097.1	333	1067	+	erm(B)	23S rRNA (adenine(2058)-N(6))-methyltransferase Erm(B)	core	AMR	AMR	LINCOSAMIDE/MACROLIDE/STREPTOGRAMIN	CLINDAMYCIN/ERYTHROMYCIN/STREPTOGRAMIN B	BLASTX	245	245	100.00	99.59	245	WP_002321849.1	23S rRNA (adenine(2058)-N(6))-methyltransferase Erm(B)	NA	NA
NA	ABNHWN020000098.1	2263	3135	+	blaCTX-M-15	extended-spectrum class A beta-lactamase CTX-M-15	core	AMR	AMR	BETA-LACTAM	CEPHALOSPORIN	ALLELEX	291	291	100.00	100.00	291	WP_000239590.1	extended-spectrum class A beta-lactamase CTX-M-15	NA	NA
NA	ABNHWN020000099.1	84	941	+	aac(3)-IIe	aminoglycoside N-acetyltransferase AAC(3)-IIe	core	AMR	AMR	AMINOGLYCOSIDE	GENTAMICIN	BLASTX	286	286	100.00	99.65	286	WP_000557452.1	aminoglycoside N-acetyltransferase AAC(3)-IIe	NA	NA
NA	ABNHWN020000100.1	84	941	+	aac(3)-IIe	aminoglycoside N-acetyltransferase AAC(3)-IIe	core	AMR	AMR	AMINOGLYCOSIDE	GENTAMICIN	EXACTX	286	286	100.00	100.00	286	WP_000557452.1	aminoglycoside N-acetyltransferase AAC(3)-IIe	NA	NA
