Protein id	Contig id	Start	Stop	Strand	Element symbol	Element name	Scope	Type	Subtype	Class	Subclass	Method	Target length	Reference sequence length	% Coverage of reference	% Identity to reference	Alignment length	Closest reference accession	Closest reference name	HMM accession	HMM description
NA	NZ_JAOSSJ010000018.1	69587	70459	-	blaCTX-M-1	extended-spectrum class A beta-lactamase CTX-M-1	core	AMR	AMR	BETA-LACTAM	CEPHALOSPORIN	ALLELEX	291	291	100.00	100.00	291	WP_013188473.1	extended-spectrum class A beta-lactamase CTX-M-1	NA	NA
NA	NZ_JAOSSJ010000048.1	281	1093	-	aph(3')-Ia	aminoglycoside O-phosphotransferase APH(3')-Ia	core	AMR	AMR	AMINOGLYCOSIDE	KANAMYCIN	EXACTX	271	271	100.00	100.00	271	WP_000018321.1	aminoglycoside O-phosphotransferase APH(3')-Ia	NA	NA
NA	NZ_JAOSSJ010000048.1	26166	27023	-	blaTEM-176	class A beta-lactamase TEM-176	core	AMR	AMR	BETA-LACTAM	BETA-LACTAM	ALLELEX	286	286	100.00	100.00	286	WP_038976851.1	class A beta-lactamase TEM-176	NA	NA
NA	NZ_JAOSSJ010000076.1	1052	2263	+	floR	chloramphenicol/florfenicol efflux MFS transporter FloR	core	AMR	AMR	PHENICOL	CHLORAMPHENICOL/FLORFENICOL	BLASTX	404	404	100.00	99.50	404	WP_021038045.1	chloramphenicol/florfenicol efflux MFS transporter FloR	NA	NA
NA	NZ_JAOSSJ010000076.1	2869	4065	-	tet(A)	tetracycline efflux MFS transporter Tet(A)	core	AMR	AMR	TETRACYCLINE	TETRACYCLINE	EXACTX	399	399	100.00	100.00	399	WP_000804063.1	tetracycline efflux MFS transporter Tet(A)	NA	NA
NA	NZ_JAOSSJ010000087.1	867	1520	-	qnrS1	quinolone resistance pentapeptide repeat protein QnrS1	core	AMR	AMR	QUINOLONE	QUINOLONE	ALLELEX	218	218	100.00	100.00	218	WP_001516695.1	quinolone resistance pentapeptide repeat protein QnrS1	NA	NA
NA	NZ_JAOSSJ010000089.1	1247	1717	+	dfrA14	trimethoprim-resistant dihydrofolate reductase DfrA14	core	AMR	AMR	TRIMETHOPRIM	TRIMETHOPRIM	EXACTX	157	157	100.00	100.00	157	WP_004201280.1	trimethoprim-resistant dihydrofolate reductase DfrA14	NA	NA
